AUTOMATIC,MANUAL
thank you,BLANK
seventy thousand years ago humans were ,seventy thousand years ago humans were 
insignificant animals the most important  ,insignificant animals the most important  
thing you need to know about our prehistoric ,thing you need to know about our prehistoric 
ancestors is that they were unimportant animals  ,ancestors is that they were unimportant animals  
their impact on the world was not greater than ,their impact on the world was not greater than 
that of fireflies or jellyfish or woodpeckers  ,that of fireflies or jellyfish or woodpeckers  
today on the other hand we control this planet ,today on the other hand we control this planet 
and what I would like to talk about today is  ,and what I would like to talk about today is  
how exactly did we reach from there to here ,how exactly did we reach from there to here 
how did we turn ourselves from insignificant  ,how did we turn ourselves from insignificant  
Apes minding their own business in a corner ,Apes minding their own business in a corner 
of Africa into the rulers of planet Earth  ,of Africa into the rulers of planet Earth  
now usually when we try to answer this question ,now usually when we try to answer this question 
we look for the answer on the individual level  ,we look for the answer on the individual level  
we want to believe I want to believe that there is ,we want to believe I want to believe that there is 
something special about me that there is something  ,something special about me that there is something  
special about my body about my brain that makes ,special about my body about my brain that makes 
me such a superior creature to a dog or a pig or a  ,me such a superior creature to a dog or a pig or a  
chimpanzee but the fact is that on the individual ,chimpanzee but the fact is that on the individual 
level I'm embarrassingly similar to a chimpanzee  ,level I'm embarrassingly similar to a chimpanzee  
if you put me in a chimpanzee together on a Long ,if you put me in a chimpanzee together on a lone
Island and we had to struggle for survival I would  ,Island and we had to struggle for survival I would  
definitely place my bets on the chimpanzee not ,definitely place my bets on the chimpanzee not 
on myself and this is not something wrong with  ,on myself and this is not something wrong with  
me personally I guess it's true of you also that ,me personally I guess it's true of you also that 
if they took any one of you almost anyone and  ,if they took any one of you almost anyone and  
place you on a long island with a chimpanzee the ,place you on a lone island with a chimpanzee the 
chimpanzee would do better the real advantage of  ,chimpanzee would do better the real advantage of  
humans is in their unique ability to cooperate ,humans is in their unique ability to cooperate 
flexibly in very large numbers now the only  ,flexibly in very large numbers they are the only  
animals that can do that there are some other ,animals that can do that there are some other 
animals like the social insects the bees and  ,animals like the social insects the bees and  
the ants that can cooperate also in quite large ,the ants that can cooperate also in a quite large 
numbers but they do so in a very legit way they're  ,numbers but they do so in a very rigid way they're  
inflexible in the way that they cooperate if there ,inflexible in the way that they cooperate if there 
is a new opportunity or a new Danger The Beehive  ,is a new opportunity or a new Danger The Beehive  
cannot change overnight its social system the ,cannot change overnight its social system the 
way that they cooperate saying execute the queen  ,way that they cooperate say execute the queen  
and let's have a republic of bees they can't do ,and let's have a republic of bees they can't do 
it they're rigid in the way that they function  ,it they're rigid in the way that they function  
there are other social animals like wolves like ,there are other social animals like wolves like 
dolphins like chimpanzees that they are much  ,dolphins like chimpanzees that they are much  
more flexible in the way that they cooperate ,more flexible in the way that they cooperate 
but they can do so only in very small numbers  ,but they can do so only in very small numbers  
because Corporation Among Wolves or amang ,because Corporation Among Wolves or amang 
shimpanzees depends on intimate and personal  ,shimpanzees depends on intimate and personal  
knowledge acquaintance one of the other if I'm ,knowledge acquaintance one of the other if I'm 
a chimpanzee and you're a chimpanzee and I want  ,a chimpanzee and you're a chimpanzee and I want  
to cooperate with you I need to know who you ,to cooperate with you I need to know who you 
are are you a good chimpanzee are you an evil  ,are are you a good chimpanzee are you an evil  
chimpanzee are you reliable are you a cheat if ,chimpanzee are you reliable are you a cheat if 
I don't know you how can I cooperate with you  ,I don't know you how can I cooperate with you  
humans are the only ones that can combine the two ,humans are the only ones that can combine the two 
abilities together cooperate very flexibly much  ,abilities together cooperate very flexibly much  
more than chimps but in very large numbers ,more than chimps but in very large numbers 
especially with large numbers of strangers  ,especially with large numbers of strangers  
One Versus One we may not be superior to ,One Versus One we may not be superior to 
chimpanzees but if you place a thousand  ,chimpanzees but if you place a thousand  
humans and a thousand chimps together on a Long ,humans and a thousand chimps together on a lone 
Island and they have to struggle then the humans  ,Island and they have to struggle then the humans  
will definitely win for the simple reason that ,will definitely win for the simple reason that 
a thousand chimpanzees cannot cooperate at all  ,a thousand chimpanzees cannot cooperate at all  
and if you now take 100 000 chimpanzees and cream ,and if you now take 100 000 chimpanzees and cram 
these 100 000 chimpanzees into Yankee Stadium or  ,these 100 000 chimpanzees into Yankee Stadium or  
Wall Street you will get chaos complete chaos ,Wall Street you will get chaos complete chaos 
but if you take a hundred thousand humans and  ,but if you take a hundred thousand humans and  
cram them together into Wall Street or into ,cram them together into Wall Street or into 
Yankee Stadium you get amazingly sophisticated  ,Yankee Stadium you get amazingly sophisticated  
networks of cooperation that are the real ,networks of cooperation that are the real 
basis for human Dominion on planet Earth  ,basis for human Dominion on planet Earth  
take even this talk that I'm now giving in front ,take even this talk that I'm now giving in front 
of you I don't know most of you there are about  ,of you I don't know most of you there are about  
200 people now in the auditorium I know maybe ,200 people now in the auditorium I know maybe 
two or three of them really well all the others  ,two or three of them really well all the others  
are basically strangers to me I don't really know ,are basically strangers to me I don't really know 
the people who organized this event yes I've met  ,the people who organized this event yes I've met  
them once or twice for rehearsal and so forth ,them once or twice for rehearsal and so forth 
but I can't say I really know them intimately  ,but I can't say I really know them intimately  
I certainly don't know the people who invented ,I certainly don't know the people who invented 
this microphone and this computer and this camera  ,this microphone and this computer and this camera  
which we are using I don't know the persons behind ,which we are using I don't know the persons behind 
the cameras which are not taking footage of what  ,the cameras which are now taking footage of what  
I say and I don't know the people who might be ,I say and I don't know the people who might be 
watching this talk over the internet somewhere  ,watching this talk over the internet somewhere  
maybe in New Guinea or New Delhi or buenos IRS ,maybe in New Guinea or New Delhi or Buenos Aires
or New York yet all of us strangers cooperate  ,or New York yet all of us strangers cooperate  
together in a very flexible and sophisticated ,together in a very flexible and sophisticated 
way to create this Global exchange of knowledge  ,way to create this Global exchange of knowledge  
this is something that chimps don't do you ,this is something that chimps don't do you 
will never catch a chimpanzee standing in  ,will never catch a chimpanzee standing in  
front of an audience of 200 other ships and ,front of an audience of 200 other chimps and 
giving a talk about bananas or about humans  ,giving a talk about bananas or about humans  
or something only humans do such things it should ,or something only humans do such things it should 
also be said however the teams not only don't give  ,also be said however that chimps not only don't give  
talks to strangers they don't also don't have ,talks to strangers they don't also don't have 
prisons they don't have concentration camps  ,prisons they don't have concentration camps  
they don't have slaughterhouses they don't have ,they don't have slaughterhouses they don't have 
honest factories Corporation is not always nice  ,arms factories Corporation is not always nice  
often when we think about cooperation we think ,often when we think about cooperation we think 
about Sesame Streets and teaching children to  ,about Sesame Streets and teaching children to  
cooperate together but all the terrible things ,cooperate together but all the terrible things 
that humans have been doing still outdoing in  ,that humans have been doing still are doing in  
the world they too are the outcome of this ability ,the world they too are the outcome of this ability 
to cooperate flexibly in very very large numbers  ,to cooperate flexibly in very very large numbers  
now suppose I've managed to convince you ,now suppose I've managed to convince you 
that the secret of success of our specie is  ,that the secret of success of our specie is  
this ability to cooperate flexibly in large ,this ability to cooperate flexibly in large 
numbers the next question that immediately  ,numbers the next question that immediately  
arises in the mind of an inquisitive person ,arises in the mind of an inquisitive person 
is how exactly humans do it what give us this  ,is how exactly humans do it what give us this  
ability to do something no other animal ,ability to do something no other animal 
can do and the answer is our imagination  ,can do and the answer is our imagination  
humans cooperate flexibly in large numbers because ,humans cooperate flexibly in large numbers because 
humans can create imagined realities together  ,humans can create imagined realities together  
all other animals use their communication ,all other animals use their communication 
system in order to describe reality  ,system in order to describe reality  
a chimpanzee can say look there is a lion run ,a chimpanzee can say look there is a lion run 
away oh look there was a banana let's take it  ,away or look there is a banana let's take it  
humans can use their language not only to describe ,humans can use their language not only to describe 
reality but also to create new realities to create  ,reality but also to create new realities to create  
fiction a human can say look there's a lion or ,fiction a human can say look there's a lion or 
looks of the banana but a human can also say look  ,look there's a banana but a human can also say look  
there is a God above the clouds and if you don't ,there is a God above the clouds and if you don't 
do what I tell you to do God will punish you and  ,do what I tell you to do God will punish you and  
if you believe this fictional story then you will ,if you believe this fictional story then you will 
do what you are told to do and this is the secret  ,do what you are told to do and this is the secret  
behind large-scale human cooperation as long as ,behind large-scale human cooperation as long as 
everybody believes in the same fictional stories  ,everybody believes in the same fictional stories  
everybody obeys the same laws and the same rules ,everybody obeys the same laws and the same rules 
and the same norms and this is something that only  ,and the same norms and this is something that only  
humans can do you can never convince a chimpanzee ,humans can do you can never convince a chimpanzee 
to do something for you by telling him look if you  ,to do something for you by telling him look if you  
do what I tell you to do you know what will happen ,do what I tell you to do you know what will happen 
after you die you'll go to chimpanzee heaven and  ,after you die you'll go to chimpanzee heaven and  
there you will receive lots and lots of bananas ,there you will receive lots and lots of bananas 
for your good deeds here on Earth so now do what  ,for your good deeds here on Earth so now do what  
I tell you to do no chimpanzee will ever believe ,I tell you to do no chimpanzee will ever believe 
such a story no chimpanzee will ever be willing to  ,such a story no chimpanzee will ever be willing to  
do anything for you in exchange for such promises ,do anything for you in exchange for such promises 
only humans can believe such fictions and this is  ,only humans can believe such fictions and this is  
why humans control the world whereas chimpanzees ,why humans control the world whereas chimpanzees 
are locked up in zoos and Research Laboratories  ,are locked up in zoos and Research Laboratories  
now you may find it possible to accept that in the ,now you may find it possible to accept that in the 
religious field cooperation is based on fiction  ,religious field cooperation is based on fiction  
that a lot of people a lot of strangers come ,that a lot of people a lot of strangers come 
together to build a cathedral or a synagogue or  ,together to build a cathedral or a synagogue or  
a mosque of God Crusade together because they all ,a mosque go on Crusade together because they all 
believe the same stories about God and Heaven and  ,believe the same stories about God and Heaven and  
Hell and so forth but what I want to emphasize is ,Hell and so forth but what I want to emphasize is 
that exactly the same thing happens in all other  ,that exactly the same thing happens in all other  
fields of human cooperation in the legal field in ,fields of human cooperation in the legal field in 
the political field in the economic field as well  ,the political field in the economic field as well  
take the legal field as an example today in the ,take the legal field as an example today in the 
world many maybe most legal systems are based  ,world many maybe most legal systems are based  
on this idea of this belief in human rights but ,on this idea or this belief in human rights but 
human rights are just like heaven and like God  ,human rights are just like heaven and like God  
it's just a fictional story that we've invented ,it's just a fictional story that we've invented 
and spread around it may be a very nice story it  ,and spread around it may be a very nice story it  
may be a very attractive story we want to believe ,may be a very attractive story we want to believe 
it but it's just a story it's not a reality it is  ,it but it's just a story it's not a reality it is  
not a biological reality just as jellyfish and ,not a biological reality just as jellyfish and 
woodpeckers and ostriches have no rights Homo  ,woodpeckers and ostriches have no rights Homo  
sapiens have no rights also take a human cut ,sapiens have no rights also take a human cut 
him open look inside you find their blood and  ,him open look inside you find their blood and  
you find the heart and lungs and kidneys but ,you find the heart and lungs and kidneys but 
you don't find there any rights the only place  ,you don't find there any rights the only place  
you find rights is in the fictional stories ,you find rights is in the fictional stories 
that humans have invented and spread around  ,that humans have invented and spread around  
and the same thing is also true in the political ,and the same thing is also true in the political 
field States and nations are also like human  ,field States and nations are also like human  
rights and like God and like heaven they too of ,rights and like God and like heaven they too of 
are just stories a mountain is a reality you can  ,are just stories a mountain is a reality you can  
see it you can touch it you can even smell it ,see it you can touch it you can even smell it 
but Israel or the United States they are just  ,but Israel or the United States they are just  
stories very powerful stories stories we might ,stories very powerful stories stories we might 
want to believe very much but still they are  ,want to believe very much but still they are  
just stories you can't really see the United ,just stories you can't really see the United 
States you cannot touch it you cannot smell it  ,States you cannot touch it you cannot smell it  
but the most successful story of all probably ,but the most successful story of all probably 
is the story of money which is one of the main  ,is the story of money which is one of the main  
Foundation of our economic system what is money ,Foundation of our economic system what is money 
you take this green piece of paper say the dollar  ,you take this green piece of paper say the dollar  
bill you can't eat it you can't drink it you ,bill you can't eat it you can't drink it you 
can't wear it it has no value but then come along  ,can't wear it it has no value but then come along  
these Master storytellers the great Bankers ,these Master storytellers the great Bankers 
the financial ministers the Prime Minister  ,the financial ministers the Prime Ministers  
the presidents and they tell a very convincing ,the presidents and they tell a very convincing 
Story look you see this green piece of paper it  ,Story look you see this green piece of paper it  
is actually worth 10 bananas and I believe it and ,is actually worth 10 bananas and I believe it and 
you believe it everybody believes it and as long  ,you believe it everybody believes it and as long  
as everybody believes it it works it really works ,as everybody believes it it works it really works 
it enables us to construct extremely sophisticated  ,it enables us to construct extremely sophisticated  
networks of economic cooperation which as I said ,networks of economic cooperation which as I said 
gave us and not the shims dominion over the world  ,gave us and not the chimps dominion over the world  
and money is really the most successful story of ,and money is really the most successful story of 
all because it's the only story everybody believes  ,all because it's the only story everybody believes  
not everybody believes in God not everybody ,not everybody believes in God not everybody 
believes in human rights not everybody believes  ,believes in human rights not everybody believes  
in the United States but everybody believes in ,in the United States but everybody believes in 
money and everybody believes in the dollar bill  ,money and everybody believes in the dollar bill  
even Osama Bin Laden he hated American politics he ,even Osama Bin Laden he hated American politics he 
hated American religion he hated American culture  ,hated American religion he hated American culture  
but it hit nothing against American dollars it ,but he had nothing against American dollars he
was quite fond of American dollars this is the  ,was quite fond of American dollars this is the  
most successful Story Ever Told to conclude then ,most successful Story Ever Told to conclude then 
humans control the world and not any other animal  ,humans control the world and not any other animal  
because humans live in a dual reality all other ,because humans live in a dual reality all other 
animals they live in an objective reality the  ,animals they live in an objective reality their  
reality consists of objective entities like rivers ,reality consists of objective entities like rivers 
and mountains and trees and lions and elephants  ,and mountains and trees and lions and elephants  
we humans we also live in an objective reality ,we humans we also live in an objective reality 
in our reality too there are rivers and trees  ,in our reality too there are rivers and trees  
and lions and elephants but on top of this ,and lions and elephants but on top of this 
objective reality we humans have constructed  ,objective reality we humans have constructed  
a second layer of fictional reality a reality ,a second layer of fictional reality a reality 
consisting of stories of fictional entities  ,consisting of stories of fictional entities  
that exist only in our imagination entities like ,that exist only in our imagination entities like 
States like money like human rights like gods  ,States like money like human rights like gods  
and the amazing thing is that as history ,and the amazing thing is that as history 
went along the fictional reality became more  ,went along the fictional reality became more  
and more powerful until today the most powerful ,and more powerful until today the most powerful 
forces in the world are these fictional entities  ,forces in the world are these fictional entities  
the very survival of rivers and trees and ,the very survival of rivers and trees and 
lions and chimpanzees today depends on the  ,lions and chimpanzees today depends on the  
wishes and decisions of fictional entities ,wishes and decisions of fictional entities 
like the United States or like Google or like  ,like the United States or like Google or like  
the World Bank entities that in fact exist only ,the World Bank entities that in fact exist only 
in our common imagination thank you [Applause],in our common imagination thank you [Applause]
foreign,BLANK
I grew up in Jerusalem not far ,I grew up in Jerusalem not far 
from here in a small family of four,from here in a small family of four
I'm a daddy's girl I love my father he's ,I'm a daddy's girl I love my father he's 
one of the kindest people I've ever met  ,one of the kindest people I've ever met  
my father worked hard his entire ,my father worked hard his entire 
life and he taught me the same thing  ,life and he taught me the same thing  
that most of us are being taught that good ,that most of us are being taught that good 
responsible people work hard and work a lot  ,responsible people work hard and work a lot  
I was living under the assumption that if I ,I was living under the assumption that if I 
want to be successful I should do something  ,wanna be successful I should do something  
in every given moment there was always something ,in every given moment there was always something 
to clean a problem to solve an email to answer or  ,to clean a problem to solve an email to answer or  
phone call to make I had a never-ending list of ,a phone call to make I had a never-ending list of 
tasks and gave myself no permission to rest until  ,task and gave myself no permission to rest until  
it was completed I believed like many others that ,it was completed I believed like many others that 
success is necessarily involved with a lot of work,success is necessarily involved with a lot of work
but it's working hard and a lot it's really ,but is working hard and a lot is really 
the effective way to create exceptional results,the effective way to create exceptional result
according to the 80 20 Pareto Principle the ,according to the 80 20 Pareto Principle the 
answer is no if you look at the distribution  ,answer is no if you look at the distribution  
of peas within pods ownership of capital and ,of peas within pods ownership of capital and 
incomes in businesses you will always see  ,incomes in businesses you will always see  
that about 80 percent of the effect comes ,that about 80 percent of the effect comes 
out of 20 of the causes and the 20 of the  ,out of 20 of the causes and the 20 of the  
effect comes out of 80 percent of the causes ,effect comes out of 80 percent of the causes 
what does it mean how does it concerns us  ,what does it mean how does it concerns us  
in every given moment every one of ,in every given moment every one of 
us is on one side of that Russia  ,us is on one side of that ratio  
either you're doing a lot and getting very ,either you're doing a lot and getting very 
little or you're doing little and getting a lot,little or you're doing little and getting a lot
ever since I've heard about the Pareto ,ever since I've heard about the Pareto 
