AUTOMATIC,MANUAL
Principle I've been looking for ways to  ,Principle I've been looking for ways to  
do less and achieve more in them about a ,do less and achieve more and then about a 
year ago I got the opportunity to practice  ,year ago I got the opportunity to practice  
under my very special circumstances ,under my very special circumstances 
which took most of my time and energy  ,which took most of my time and energy  
I became paralyzed I had no physical abilities ,I became paralyzed I had no physical abilities 
to invest only my mind my will my intention  ,to invest only my mind my will my intention  
I became ill with an autoimmune ,I became ill with an autoimmune 
disease called Guillain-Barre syndrome  ,disease called Guillain-Barre syndrome  
although it sounds like a name of a French lover ,although it sounds like a name of a French lover 
Gian Beret is a severe neurological disease which  ,Guillain-Barre is a severe neurological disease which  
caused sensory and motoric paralysis if it is not ,caused sensory and motoric paralysis if it is not 
diagnosed or treated on time it might cause death  ,diagnosed or treated on time it might cause death  
the body attacks the meal in the substance ,the body attacks the myelin the substance 
which covers all of the nerves in our body  ,which covers all of the nerves in our body  
and is responsible for the neurological ,and is responsible for the neurological 
conjunction including physical sensation  ,conjunction including physical sensation  
movement and function of the inner organs at ,movement and function of the inner organs at 
the time I got sick I Was preparing for half  ,the time I got sick I Was preparing for half  
a marathon for the second time in a row and ,a marathon for the second time in a row and 
was excited in the preparation for the big day  ,was excited in the preparation for the big day  
but as John Lennon said life is what happens ,but as John Lennon said life is what happens 
to you while you're busy making other plans  ,to you while you're busy making other plans  
it took a while for me and my doctors to ,it took a while for me and my doctors to 
understand this was no flu for two weeks I  ,understand this was no flu for two weeks I  
experienced the cold sensation in the tips of my ,experienced the cold sensation in the tips of my 
fingers I lost sensation in my arms and my legs I  ,fingers I lost sensation in my arms and my legs I  
became stiffer and experienced extreme exhaustion ,became stiffer and experienced extreme exhaustion 
a 10-minute walk took me an hour and a half  ,a 10-minute walk took me an hour and a half  
climbing up the stairs to my house 20 ,climbing up the stairs to my house 20 
minutes my Pace kept declarating and  ,minutes my Pace kept declarating and  
instead of running to the finish line ,instead of running to the finish line 
I found myself crawling to the hospital,I found myself crawling to the hospital
a week and a half before a Purim holiday I was at ,a week and a half before Purim holiday I was at 
the hospital before receiving treatment and was  ,the hospital before receiving treatment and was  
losing more and more of my basic capabilities ,losing more and more of my basic capabilities 
Purim is a Jewish version of Halloween it's a  ,Purim is a Jewish version of Halloween it's a  
commandment to be happy on touring holiday so ,commandment to be happy on Purim holiday so 
everyone will celebrate and wearing costumes  ,everyone are celebrate and wearing costumes  
when my daughter and my dear ex visit me at the ,when my daughter and my dear ex visit me at the 
hospital I realized I won't be able to help her  ,hospital I realized I won't be able to help her  
get dressed on Prairie morning I was told not ,get dressed on Purim morning I was told not 
to make any plans for the next month to come I  ,to make any plans for the next month to come I  
remember lying there at the hospital bed thinking ,remember lying there at the hospital bed thinking 
to myself I have no choice but to store all of my  ,to myself I have no choice but to store all of my  
belongings say goodbye to my former life and go ,belongings say goodbye to my former life and go 
leave at my mother's house for the next few months  ,live at my mother's house for the next few month 
I was being realistic and completely desperate ,I was being realistic and completely desperate 
it was my darkest time I'm not sure what was  ,it was my darkest time I'm not sure what was  
there beyond my desperation but all of a sudden ,there beyond my desperation but all of a sudden 
I thought it's just a statistic a distribution  ,I thought it's just a statistic a distribution  
it's a probability like all probabilities that ,it's a probability like all probabilities that 
has the average which is the majority of people  ,has the average which is the majority of people  
but also has the extreme the dots outside the ,but also has the extreme the dots outside the 
graph and I realized that even if the chances  ,graph and I realized that even if the chances  
were slight they still existed I knew the most of ,were slight they still existed I knew the most of 
the result depended on me who am I concerning the  ,the result depended on me who am I concerning the  
odds what am I going to do to heal myself I had ,odds what am I going to do to heal myself I had 
a purpose right there to be healthy as soon as  ,a purpose right there to be healthy as soon as  
possible and going back being my daughter's mother ,possible and going back being my daughter's mother 
again I've decided to put all of my intention in  ,again I've decided to put all of my intention in  
what I had rather in what I was losing back then ,what I had rather in what I was losing back then 
the difference between doing something with my  ,the difference between doing something with my  
intention or doing it without my intention was ,intention or doing it without my intention was 
the difference between trying and succeeding,the difference between trying and succeeding
I knew that every day without movement will add ,I knew that every day without movement will add 
significant time to my Rehabilitation so I didn't  ,significant time to my Rehabilitation so I didn't  
wait a second before I took responsibility in ,wait a second before I took responsibility in 
my health and long before the physical therapy  ,my health and long before the physical therapy  
began I combined between keep resting and moving ,began I combined between keep resting and moving 
I got myself healthy food vitamins and a variety  ,I got myself healthy food vitamins and a variety  
of physical treatment from friends who wanted to ,of physical treatment from friends who wanted to 
help out on the second day of my medical treatment  ,help out on the second day of my medical treatment  
I was half paralyzed in a wheelchair when I ,I was half paralyzed in a wheelchair when I 
crossed the stairway with 16 stairs and a rail  ,crossed the stairway with 16 stairs and a rail  
I remember quietly looking at them for a ,I remember quietly looking at them for a 
few moments and wondered if I can climb them  ,few moments and wondered if I can climb them  
and there I was sitting in the bottom of the ,and there I was sitting in the bottom of the 
stairway taking a deep breath imagining myself  ,stairway taking a deep breath imagining myself  
climbing up the stairs it seemed impossible ,climbing up the stairs it seemed impossible 
suddenly I heard music in the back of my mind,suddenly I heard music in the back of my mind
and I started climbing up the stairs with ,and I started climbing up the stairs with 
the agility of a sloth from the outside I  ,the agility of a sloth from the outside I  
looked like a paralyzed woman hardly pulling ,looked like a paralyzed woman hardly pulling 
herself on a stairway in my mind however I  ,herself on a stairway in my mind however I  
was Rocky Balboa during his victory much ,was Rocky Balboa during his victory much 
with every step I became happier and as  ,with every step I became happier and as  
I reached the top of the stairway a ,I reached the top of the stairway a 
few minutes later I felt Victorious,few minutes later I felt Victorious
thank you,BLANK
a minute later I was back in a wheelchair  ,a minute later I was back in a wheelchair  
exhausted and needed my mom to ,exhausted and needed my mom to 
push me back to the Department  ,push me back to the Department  
my life looked a lot like that in the past year ,my life looked a lot like that in the past year 
from being Victorious to disable and Back Again,from being Victorious to disable and Back Again
when I returned home beans were piling up ,when I returned home bills were piling up 
my income stopped I had a child to raise  ,my income stopped I had a child to raise  
and customers waiting for my return and yet ,and customers waiting for my return and yet 
my body was full with pain as a result of the  ,my body was full with pain as a result of the  
neurological Revival I had to do less and Achieve ,neurological Revival I had to do less and Achieve 
so much more life didn't wait for me for a second,so much more life didn't wait for me for a second
in many mornings I was standing in a crossbody ,in many mornings I was standing in a crossroad 
of choices between lying on the couch all day  ,of choices between lying on the couch all day  
long and proceeding with my life in order ,long and proceeding with my life in order 
to leave the couch I had to enroll my  ,to leave the couch I had to enroll my  
Consciousness told my day and choose despite the ,Consciousness toward my day and choose despite the 
circumstances to be a contributing useful person  ,circumstances to be a contributing useful person  
every morning I asked myself what is my purpose ,every morning I asked myself what is my purpose 
what are my intentions who do I want to be today,what are my intentions who do I wanna be today
the statistic shows that the average ,the statistic shows that the average 
time for a Guillain-Barre patient  ,time for a Guillain-Barre patient  
is 38 days in department and anywhere between ,is 38 days in department and anywhere between 
three weeks and three months in Rehabilitation  ,three weeks and three months in Rehabilitation  
I spent only 10 days in department and five days ,I spent only 10 days in department and five days 
in Rehabilitation and guess what else happened  ,in Rehabilitation and guess what else happened  
on Prairie morning I was home on vacation from ,on Purim morning I was home on vacation from 
the hospital and helped my girl with her custom  ,the hospital and helped my girl with her costume
I have learned that what happens on my ,I have learned that what happens on my 
inside has a huge effect on my outside  ,inside has a huge effect on my outside  
from the inside I was a winner athlete Dreamer ,from the inside I was a winner athlete Dreamer 
Consciousness coach and I remember that my  ,Consciousness coach and I remembered that my  
intention will determine whether I will be with ,intention will determine whether I will be with 
the most of the other girl by a patient at the  ,the most of the other Guillain-Barre patient at the  
average or will I be a DOT away from the graph ,average or will I be a DOT away from the graph 
from the outside even though I was active only  ,from the outside even though I was active only  
seven months of it 2014 was one of the best ,seven months of it 2014 was one of the best 
years of my life personally and professionally  ,years of my life personally and professionally  
we are all living in such a fast pace we are all ,we are all living in such a fast pace we are all 
connected in almost every moment to our emails  ,connected in almost every moment to our emails  
and our cell phones and we expect it to react ,and our cell phones and we expect it to react 
immediately and be available we all have our  ,immediately and be available we all have our  
circumstances to handle and so many times we're ,circumstances to handle and so many times we're 
taking actions in a hurry sometimes out of our  ,taking actions in a hurry sometimes out of our  
stress our fear our pain or our anger then we can ,stress our fear our pain or our anger then we can 
find ourselves doing a lot and getting very little  ,find ourselves doing a lot and getting very little  
or at the worst case we can find ourselves making ,or at the worst case we can find ourselves making 
damage in which we have to take care of later  ,damage in which we have to take care of later  
I'm still recovering for my disease ,I'm still recovering for my disease 
and feel it impact in my daily life  ,and feel its impact in my daily life  
it has taught me to stop and pay ,it has taught me to stop and pay 
attention before I take actions  ,attention before I take actions  
I have learned that it's not the amount of actions ,I have learned that it's not the amount of actions 
that will determine my result it's the quality of  ,that will determine my result it's the quality of  
action that matters when I'm setting my intention ,action that matters when I'm setting my intention 
then I'm present in the moment in my body I become  ,then I'm present in the moment in my body I become  
clear with my purpose and I can recognize whether ,clear with my purpose and I can recognize whether 
my action is valuable for me and for the people  ,my action is valuable for me and for the people  
around me or not and if it's not then take no ,around me or not and if it's not then take no 
action is sometimes better more than anything my  ,action is sometimes better more than anything my  
disease gave me a year of practice and a constant ,disease gave me a year of practice and a constant 
reminder that in every given moment I can stop  ,reminder that in every given moment I can stop  
and through my will my choice and my intention be ,and through my will my choice and my intention be 
on that side of the Pareto distribution in which  ,on that side of the Pareto distribution in which  
I do less and get so much more which side would ,I do less and get so much more which side would 
you like to be which side would you choose to be,you like to be which side would you choose to be
[Music],[Music]
good,BLANK
we can improve people's lives by improving their ,we can improve people's lives by improving their 
appearance that means that you can make a change  ,appearance that means that you can make a change  
from without think about it most ,from without think about it most 
celebrities are not born gorgeous  ,celebrities are not born gorgeous  
they just realize how much their appearance ,they just realize how much their appearance 
affect their success do you know who this is,affect their success do you know who this is
I can hear you sing,I can hear you sing
and now,and now
imagine became the sex goddess Marilyn Monroe ,Norma Jeane became the sex goddess Marilyn Monroe 
it is only depends on how she looks such changes  ,it is only depends on how she looks that changes  
everything when people look at you what do they ,everything when people look at you what do they 
see what do you want them to think about you  ,see what do you want them to think about you  
in the next few minutes I'm going to share ,in the next few minutes I'm going to share 
with you some tips on how you can improve your  ,with you some tips on how you can improve your  
first impression actually I Define myself as an ,first impression actually I Define myself as an 
impression expert more than an personal stylist  ,impression expert more than an personal stylist  
as a young girl with ADHD no ability to ,as a young girl with ADHD no ability to 
concentrate in class and hardly read or  ,concentrate in class and hardly read or  
write I've heard from the education system that ,write I've heard from the education system that 
my entire Eternal capabilities are insufficient  ,my entire Eternal capabilities are insufficient  
since I was insufficient within I ,since I was insufficient within I 
decided to improve myself from without  ,decided to improve myself from without  
I want to show you something that was me uh-huh  ,I wanna show you something that was me uh-huh  
I was just Keen not curved huge glasses shapeless ,I was just skin not curved huge glasses shapeless 
hair or in plain English I wasn't impressive  ,hair or in plain English I wasn't impressive  
so I wanted to change myself and that's what ,so I wanted to change myself and that's what 
I did at the next morning I came to school  ,I did at the next morning I came to school  
a completely different person everybody ,a completely different person everybody 
looked at me different even the teacher  ,looked at me different even the teacher  
looked at me differently all of a sudden hold the ,looked at me differently all of a sudden whole the 
learning environment wanted to help me succeed,learning environment wanted to help me succeed
so I realized that everything changed for me ,so I realized that everything changed for me 
for the better just because I looked better  ,for the better just because I looked better  
it was the first time I realized that ,it was the first time I realized that 
the change can start from the outside  ,a change can start from the outside  
success also works from the outside so ,success also works from the outside so 
basically I wanted to know everything I  ,basically I wanted to know everything I  
could about the ideal of beauty despite my ,could about the ideal of beauty despite my 
disabilities I found myself for more than  ,disabilities I found myself for more than  
12 years in various universities only to find ,12 years in various university only to find 
out that it's all about all about proportions  ,out that it's all about all about proportions  
it's all about a very special ,it's all about a very special 
proportion called the golden ratio,proportion called the golden ratio
it is a pattern that the human eyes likes ,it is a pattern that the human eyes likes 
to see the ratio is one to 1.618 it is a  ,to see the ratio is one to 1.618 it is a  
very special ratio for example if we will take ,very special ratio for example if we will take 
a rectangles with these proportions it can copy  ,a rectangles with these proportions it can copy  
itself indefinitely when every one of these ,itself indefinitely when every one of these 
rectangles keeps exactly the same proportion  ,rectangles keeps exactly the same proportion  
we can find it as well everywhere like in ,we can find it as well everywhere like in 
smallest things like our DNA when the length  ,smallest things like our DNA when the length  
of one sequence is 1.618 longer than its string we ,of one sequence is 1.618 longer than its string we 
can find us even in new things like the pyramids  ,can find this even in new things like the pyramids  
the golden ratio is embedded in most forms ,the golden ratio is embedded in most forms 
people likes to see like the human body,people likes to see like the human body
and face with a gun made it or man ,and face whether God made it or man 
made it it is there it is what it is  ,made it it is there it is what it is  
without even noticing people will engage with our ,without even noticing people will engage with our 
image the closer our image is to the golden ratio  ,image the closer our image is to the golden ratio  
since not all of us were born with the ,since not all of us were born with the 
perfect body proportion you may ask  ,perfect body proportion you may ask  
how can we bring ourselves closer to these ,how can we bring ourselves closer to these 
golden proportions so here is this thought,golden proportions so here is this thought
if Beauty has mathematical formula then it's ,if Beauty has mathematical formula then it's 
supposed to be easy to achieve to make it  ,supposed to be easy to achieve to make it  
more accessible I decided decided to create a ,more accessible I decided decided to create a 
software that will be based on the golden ratio  ,software that will be based on the golden ratio  
and the way people perceive colors and shape and ,and the way people perceive colors and shape and 
this is very funny how people perceive shapes  ,this is very funny how people perceive shapes  
by the way it's like a game okay it's like a ,by the way it's like a game okay it's like a 
game of reality versus perception reality is  ,game of reality versus preception reality is  
the true existence of form in our universe while ,the true existence of form in our universe while 
perception is how our brain translate these forms  ,preception is how our brain translate these forms  
illusion means tricking the mind to get a new ,illusion means tricking the mind to get a new 
perception example look at these two dots in  ,preception example look at these two dots in  
reality they look the same they have the same size ,reality they look the same they have the same size 
but adding different forms or colors around them  ,but adding different forms or colors around them  
make us feel that they are different so so if ,make us feel that they are different so if 
I will add around me different clothes colors  ,I will add around me different clothes colors  
and accessorize you will think I'm different ,and accessorize you will think I'm different 
I call the game of dressing up an illusion  ,I call the game of dressing up an illusion  
and right here lies the solution we can use ,and right here lies the solution we can use 
illusion in order to change our proportions to a  ,illusion in order to change our proportions to a  
better one to those who close to the golden ratio ,better one to those who close to the golden ratio 
what's the benefits besides you looking your best,what's the benefits besides you looking your best
people will feel more comfortable ,people will feel more comfortable 
with you and your appearance  ,with you and your appearance  
when you go when you're closer to the golden ratio,when you go when you're closer to the golden ratio
I want to share something with you it's going ,I wanna share something with you it's gonna   
to be probably quite funny look at me and you  ,be probably quite funny look at me and you
can laugh as much as you want I want to show you ,can laugh as much as you want I wanna show you 
how God really created me I just started late  ,how God really created me I just started late  
okay is it terrible enough wait wait and ,okay is it terrible enough wait wait and 
now imagine me coming to you right now and  ,now imagine me coming to you right now and  
telling you hello my name is Orly shy I'm ,telling you hello my name is Orly Shay I'm 
the best stylist in the world do you want  ,the best stylist in the world do you wanna  
to do shopping or work with me anyway no one ,do shopping or work with me anyway no one 
will believe me I tried it by the way what  ,will believe me I tried it by the way what  
happened right now that the shape or the place ,happened right now that the shape or the place 
that my eyes are located is higher on my face  ,that my eyes are located is higher on my face  
so basically what I need to do is add more volume ,so basically what I need to do is add more volume 
to the top of my head okay with my hair and voila,to the top of my head okay with my hair and voila
thank you wait another example look at the shape ,thank you wait another example look at the shape 
of my chin let's make a quick jump to improve the  ,of my chin let's make a quick jump to improve the  
shape of my chin basically the shape of my chin is ,shape of my chin basically the shape of my chin is 
very narrow in comparison to what it was supposed  ,very narrow in comparison to what it was supposed  
to be so my mommy here so Mommy I'm sorry so what ,to be so my mommy here so Mommy I'm sorry so what 
I'm doing is I'm adding more horizontal lines  ,I'm doing is I'm adding more horizontal lines  
with my hair cut here this is first thing ,with my haircut here this is first thing 
I'm doing and the next thing I'm going to do  ,I'm doing and the next thing I'm going to do  
is to create another horizontal line ,is to create another horizontal line 
here at my neckline now look at my face  ,here at my neckline now look at my face  
while I'm having a horizontal line here and there ,while I'm having an horizontal line here and there 
they look a little bit wider than if I will add  ,they look a little bit wider than if I will add  
vertical lines can you see that again horizontal ,vertical lines can you see that again horizontal 
much better early vertical line do you see  ,much better Orly vertical line do you see  
