AUTOMATIC,MANUAL
of my journey and my journey for me personally ,of my journey and my journey for me personally 
is the journey looking for my culinary Legacy  ,is the journey looking for my culinary Legacy  
my journey my journey began around not around 20 ,my journey my journey began around not around 20 
years ago when I was a young cook and I started  ,years ago when I was a young cook and I started  
looking for for the Legacy and my journey began at ,looking for for the Legacy and my journey began at 
foreign countries in libraries in study halls but  ,foreign countries in libraries in study halls but  
pretty soon my journey shifted here to Israel ,pretty soon my journey shifted here to Israel 
shifted into kitchens hot stoves sharp knives,shifted into kitchens hot stoves sharp knives
pilot lights and I pretty soon realized ,pilot lights and I pretty soon realized 
that as a person that was born raised and  ,that as a person that was born raised and  
lived all his life and now raising his ,lived all his life and now raising his 
own family in the city of Jerusalem if  ,own family in the city of Jerusalem if  
I want to find my culinary Legacy I should ,I want to find my culinary Legacy I should 
start looking it for it here in Jerusalem  ,start looking it for it here in Jerusalem  
so where to look I was uh I think I ,so where to look I was uh I think I 
was thinking maybe I should look in in  ,was thinking maybe I should look in in  
um authentic or aromatic Bagel in the old city or ,um authentic or aromatic Bagel in the old city or 
maybe a sweet Kegel in my sharim or should I go  ,maybe a sweet Kegel in Mea She'arim or should I go  
with the all sides included burekas from Musa ,with the all sides included burekas from Musa burekas
in Jaffa Road maybe just a chunky hummus with  ,in Jaffa Road maybe just a chunky hummus with  
a Laffer but realizing without all these amazing ,a Laffa but realizing without all these amazing 
dishes without all these amazing recipes that are  ,dishes without all these amazing recipes that are  
so jerusalemite and so local for me things don't ,so jerusalemite and so local for me things don't 
add up in my mind or in my case in my stomach  ,add up in my mind or in my case in my stomach  
so I went to look for the origin for these ,so I went to look for the origin for these 
well-known well-loved so popular dishes I went  ,well-known well-loved so popular dishes I went  
and I went on a quest searching and in my quest ,and I went on a quest searching and in my quest 
I stumbled upon a quote from vishnavot on a wall  ,I stumbled upon a quote from Mishnah Avot on a wall  
of this amazing small bakery next to one of my ,of this amazing small bakery next to one of my 
restaurants I'll let you read it by yourself and,restaurants I'll let you read it by yourself and
I especially like the last part whereas I ,I especially like the last part whereas I 
get up and find all these things done for me  ,get up and find all these things done for me  
you can imagine how I like that part but um to be ,you can imagine why I like that part but um to be 
honest our ancestors they didn't have they didn't  ,honest our ancestors they didn't have they didn't  
have things so easy it wasn't they couldn't go ,have things so easy it wasn't they couldn't go 
to Ram 11 buy a loaf of bread they had to grow  ,to Rami Levi buy a loaf of bread they had to grow  
the weed themselves they had to to search Grow ,the weed themselves they had to to search Grow 
hunt their own food and I started searching how  ,hunt their own food and I started searching how  
did they do that and realizing that situation ,did they do that and realizing that situation 
here back then wasn't that easy like in Europe  ,here back then wasn't that easy like in Europe  
because rain doesn't it doesn't rain here as much ,because rain doesn't it doesn't rain here as much 
as in Europe water is not that common Roots fruits  ,as in Europe water is not that common Roots fruits  
vegetables even even animals are more rare here ,vegetables even even animals are more rare here 
so I found that our ancestors were pretty smart  ,so I found that our ancestors were pretty smart  
they had with wheat was the most common thing they ,they had wheat wheat was the most common thing they 
had to eat to produce flower form so they used the  ,had to eat to produce flour from so they used the  
wheat throughout the year in order to have food ,wheat throughout the year in order to have food 
and and nourish themselves throughout the year  ,and and nourish themselves throughout the year  
they use the wheat very smartly I learned ,they use the wheat very smartly I learned 
that they used to pick it when only at the  ,that they used to pick it when only at the  
beginning when it grew when it was still green ,beginning when it grew when it was still green 
just pick it from the field and eat the stalks  ,just pick it from the field and eat the stalks  
pretty tasty you should try it one time and and ,pretty tasty you should try it one time and and 
they used to call it spring or the Arabs called  ,they used to call it spring or the Arabs called  
it gamail akda then later on when it's dried ,it Gama Al Akdar then later on when it's dried 
they used to pick the stocks and and the whole  ,they used to pick the stocks and and the whole  
the whole plan and then make big piles in the ,the whole plant and then make big piles in the 
field and light fires around it so the smoke from  ,field and light fires around it so the smoke from  
the fire used to preserve the grains of the weed ,the fire used to preserve the grains of the wheat 
that way they could collect the grains and keep  ,that way they could collect the grains and keep  
them throughout the year because the smoke stops ,them throughout the year because the smoke stops 
they're maturing and and they then they could mail  ,their maturing and and they then they could mill
it later on the year after taking out the grains ,it later on the year after taking out the grains 
they used to they gave them to the Miller and the  ,they used to they gave them to the miller and the  
Millers milled them into fine flour giving the ,millers milled them into fine flour giving the 
flower back to the families to cook their bread  ,flour back to the families to cook their bread  
or bake the bread or back then the Harvest or ,or bake their bread or back then the Khobez or 
the lava as we know it now the bagel or Destroyer  ,the Laffa as we know it now the bagel or the strudel
but the Millers found an amazing thing in ,but the millers found an amazing thing in 
the Milling Stone there was something left  ,the Milling Stone there was something left  
the grain of the weed the the center of the wind ,the grain of the wheat the the center of the wheat 
could not be grinded because of Technology reasons  ,could not be grinded because of Technology reasons  
it wasn't sharp enough they couldn't grind it and ,it wasn't sharp enough they couldn't grind it and 
they found out that the center of the width which  ,they found out that the center of the wheat which  
then they called semolina is the best part of ,then they called semolina is the best part of 
the way the sweetest the one you can bake the  ,the wheat the sweetest the one you can bake the  
most amazing and cook the most amazing dishes ,most amazing and cook the most amazing dishes 
from it was so precious that the Millers sold  ,from it was so precious that the millers sold  
it very very in a very high price and it it was so ,it very very in a very high price and it it was so 
precious that it became a sacrifice in the temple  ,precious that it became a sacrifice in the temple  
um the the priest with the poor honey and oil ,um the the priest would uh pour honey and oil 
over the of the semolina and then praise it  ,over the over the semolina and then praise it  
and yeah it was so precious and so well loved ,and yeah it was so precious and so well loved 
that even after the destruction of the Temple  ,that even after the destruction of the Temple  
it the Habit became that you cook a sweet semolina ,it the Habit became that you cook a sweet semolina 
cake or as my mother my dear partner who his  ,cake or as my mother my dear partner whose
mother called it that's herbus booster by the way ,mother called it Basbousa that's her Basbousa by the way 
um they would bake this special this special cake  ,um they would bake this special this special cake  
in in special events or for special people that's ,in in special events or for special people that's 
the way from the roof the journey for the grain  ,the way from the route the journey for the grain  
of the with being picked in the field becoming a ,of the wheat being picked in the field becoming uh
habit or a legacy of of a country or of a group  ,habit or a legacy of of a country or of a group  
of people that understanding this Ruth uh was ,of people that understanding this route uh was 
mind-blowing for me and it made me feel that my  ,mind-blowing for me and it made me feel that my  
journey as a young chef is totally connected to ,journey as a young chef is totally connected to 
the journey of the grain of the will my journey  ,the journey of the grain of the wheat my journey  
is the Journey of the of the spring and the gamma ,is the Journey of the of the spring and the Gama  
Alaska and of the freaky the green the green with  ,Al Akdar and of the freekeh the green the green wheat 
um and and realizing that this is my journey along ,um and and realizing that this is my journey along 
the 2000 years of wondering of people bringing  ,the 2000 years of wondering of people bringing  
here to Israel all these amazing products like ,here to Israel all these amazing products like 
the grain of the weed like the the semolina cake  ,the grain of the wheat like the the semolina cake  
like the polenta like the corn like the potatoes ,like the polenta like the corn like the potatoes 
and you can go on in your mind about all these  ,and you can go on in your mind about all these  
amazing products they brought here and what the ,amazing products they brought here and what the 
khamene we call it it's it was all brought here  ,Hamin we all eat it's it was all brought here  
so realizing that taught me ,so realizing that taught me 
a lesson of utmost importance  ,a lesson of utmost importance  
it taught me a lesson that in the kitchen like in ,it taught me a lesson that in the kitchen like in 
science like in art like in literature you cannot  ,science like in art like in literature you cannot  
start something new without being zealous ,start something new without being zealous 
to the ancient and the wise you do not have  ,to the ancient and the wise you do not have  
a path without a starting point you do not have ,a path without a starting point you do not have 
a three of fruits without the soil and the seed  ,a tree of fruits without the soil and the seed  
I don't have a restaurant in the center ,I don't have a restaurant in the center 
of London without Kube in Magnolia markets  ,of London without Kube in Machaneh Yehudah market
that was the lesson I learned so six years ,that was the lesson I learned so six years 
ago just opened my restaurant my first one  ,ago just opened my restaurant my first one  
super excited all of us in the kitchen ,super excited all of us in the kitchen 
the restaurant is packed we didn't expect  ,the restaurant is packed we didn't expect  
so many people even my parents didn't ,so many people even my parents didn't 
have a place to sit sorry guys and um  ,have a place to sit sorry guys and um  
and I'm looking at the fridges and the chefs ,and I'm looking at the fridges and the chefs 
behind me they say Chef were running out of food  ,behind me they say Chef we're running out of food  
and in about a minute I have to go out and tell ,and in about a minute I have to go out and tell 
people they have to leave the restaurant because  ,people they have to leave the restaurant because  
I have nothing to give them so I shout back to ,I have nothing to give them so I shout back to 
the chefs what do we have left on the storage  ,the chefs what do we have left on the storage  
and they say we got some corn some asparagus some ,and they say we got some corn some asparagus some 
mushrooms we quickly made a polenta and we had no  ,mushrooms we quickly made a polenta and we had no  
plates to serve with him because we were just open ,plates to serve with him because we were just open 
and we we didn't buy enough plates so I caught  ,and we we didn't buy enough plates so I caught  
a glimpse of some pickle jars we just got that ,a glimpse of some pickle jars we just got that 
morning to make some pickles and I in a moment of  ,morning to make some pickles and I in a moment of  
probably craziness I told my sous chef just ,probably craziness I told my sous chef just 
wash them we put the hot polenta in them and  ,wash them we put the hot polenta in them and  
served it in in the in the jar that that ,served it in in the in the jar that that 
was the birth of magniuda's famous polenta,was the birth of Machneyuda's famous polenta
a man whose work is ass off for 20 ,a man whose work is ass off for 20 
years and then one job gets Applause,years and then one jar gets Applauses
so uh from that day thousands of polenta dishes ,so uh from that day thousands of polenta dishes 
went out in pickle jars from from talbier and from  ,went out in pickle jars from from Tal Bir and from  
Hebron Road from magnauda and from London and when ,Hebron Road from Machneyuda and from London and when 
it all comes down and I sit down with myself and  ,it all comes down and I sit down with myself and  
the noise of the kitchen and the pressure Goes ,the noise of the kitchen and the pressure Goes 
Down And Memories start pouring in I I remember  ,Down And Memories start pouring in I I remember  
myself as a young child and I remember my mother ,myself as a young child and I remember my mother 
cooking a polenta-like porridge sweet polenta like  ,cooking a polenta-like porridge sweet polenta like  
porridge for me and I was sitting and eating it so ,porridge for me and I was sitting and eating it so 
slowly in circles because I liked it so much and I  ,slowly in circles because I liked it so much and I  
didn't want to get to the last spoon in the center ,didn't want to get to the last spoon in the center 
and I it that it it is this moment that makes me  ,and I it that it it is this moment that makes me  
realize I chose in that stressful moment to make ,realize I chose in that stressful moment to make 
a polenta because of that memory memory of the  ,a polenta because of that memory memory of the  
child eating that unfinishing porridge and it in ,child eating that unfinishing porridge and it in 
that moment I realized that I am made from what  ,that moment I realized that I am made from what  
I was as a chef I made from what my ancestors ,I was as a chef I made from what my ancestors 
were I am the two thousand years of wandering  ,were I am the two thousand years of wandering  
I am the matzah I am the dates that come from ,I am the matzah I am the dates that come from 
Jericho and I am the olive that grow in the Ella  ,Jericho and I am the olive that grow in the Ella  
I'm the fish that are caught ,I'm the fish that are caught 
in the shores of Gaza and Jaffa,in the shores of Gaza and Jaffa
I am the Hunter and I break down the meat I am ,I am the Hunter and I break down the meat I am 
the grinder and I'm the baker I go 40 years in  ,the grinder and I'm the baker I go 40 years in  
the desert and I bring the Clusters to the ,the desert and I bring the Clusters to the 
promised land I'm the Roman soldier at the  ,promised land I'm the Roman soldier at the  
feet of Masada and I'm the last man barricaded ,feet of Masada and I'm the last man barricaded 
in the temple I'm a slave and I'm a priest,in the temple I'm a slave and I'm a priest
I'm a poet and a believer I've ,I'm a poet and a believer I've 
been banished and I've returned,been banished and I've returned
I'm wondering but I'm a settler  ,I'm wandering but I'm a settler  
I am the porridge and I'm the polenta I'm the ,I am the porridge and I'm the polenta I'm the 
bossa and I'm the student I'm Kube and I'm sushi,Basbousa and I'm the strudel I'm Kube and I'm sushi
everything has already been said more than that ,everything has already been said more than that 
everything has already been cooked but only when  ,everything has already been cooked but only when  
I truly respect and master the legacies before me ,I truly respect and master the legacies before me 
then I start creating a legacy of my own thank you,then I start creating a legacy of my own thank you
